Software TestStand Engineer - Defence;SK3, Stockport;Unspecified;AKKA Development UK Limited;Software TestStand Engineer- Hybrid Working (Cheadle) * Flexi-time (40hr week) * Private Healthcare & Pension * 28 holiday + Bank Holidays AKKAs Software team is growing thanksto successful project wins and achievements over the last few years in the Defence industry. The team provides a wide range of flexible support across development and test, supporting larger critical programmes for our Defence customers. What you will be doing * Developing a TestStand test management system in accordance with an already-written internal specification. * Creation of automated tests on target hardware and simulated environments * Collation of results and reporting to stakeholders * Supporting, encouraging and sharing knowledge with other team members whilst promoting best practice What you will need
Software Developer;Halifax, West Yorkshire;Negotiable;Rise Technical Recruitment Limited;Halifax / Hybrid £45,000 + Progression + 25 days Holiday + Growing Team + Hybrid Working + Onsite Parking Are you a confident Software Developer looking to join an exciting company with an expanding and growing tech department? This company have been leading their market for 15 + years and are looking to continue their growth and expansions. A big part of that requires adding another Software Developer to join the tech team and help the company to achieve their desired growth plans. In this role you will play a key part developing new and existing web based systems to meet the businesses technical requirements, test software, fix problems and maintain and develop code. You will be working predominantly with ASP.NET, JavaScript, SQL Server, HTML and CSS.
Principal Software Engineer;Lacey Green, SK9;£65000 - £75000 per annum;Chroma Recruitment Ltd;A world leading engineering company are recruiting for a Principal Software Engineer to strengthen their R&D team. This is due to continued growth and a large uplift in projects involving analytical equipment. The Principal Software Engineer needs to be a dynamic and agile individual, managing business-as-usual whilst enhancing and developing new technologies. The Principal Software Engineer reports directly to the Chief Engineer in the team whilst working collaboratively with the other Software and Hardware Engineers on designing, developing and prototyping concepts for client projects. The role of Principal Software Engineer is hybrid, going on site a couple of times a week when needed to work collaboratively on projects. * Degree in Engineering/Computer Science or equivalent) * C# (in an engineering environment) * Linux/VxWorks * Experience working on hardware
Java Software Engineer;Manchester, Greater Manchester;£40k - 45k per year;ECOM Manchester;A bit about the company This company delivers innovative, autonomous software solutions and content services to the entertainment industry worldwide as they draw on all elements of different operations and content services together into a single, automated workflow. They have a truly global reach; the products that have developed products are used in 90 different countries around the world making them the leading digital entertainment solution provider and their customers include the major Hollywood and independent film studios and the largest cinema operators. Team and Job Purpose The company feels, acts, and behaves as one big team, working inclusively and collaboratively to develop innovative products by encouraging employees to share their ideas.
Full-Stack Software Engineer;PR1, Preston;£50,000;Hyperloop Recruitment;£50,000 Preston (remote-first) Hyperloop Recruitment are working with a leading software solutions provider in Preston who are recruiting for a Full-Stack Software Engineer to join their growing development team, on a remote-first basis. Our client are looking for a strong mid-level Full-Stack Software Engineer who is a confident using object-oriented PHP alongside a MySQL database. On the frontend you will be focused on React and TypeScript, and NodeJS for some standalone features would be an advantage. All code is unit tested and deployed using GitLab hosted on AWS. The role would suit a strong Engineer looking for an exciting next step in their career, with the opportunity to become a key player in shaping the technical direction of our clients' features and products. The Full-Stack Software Engineer will be entitled to a salary of up to £50,000 (DOE) + benefits.
Software Developer;City Centre, M2 5DB;From £40,000 to £60,000 per annum plus pension, healthcare, holidays &;MATCHED GROUP LIMITED;Basic:£40,000 - £60,000 + benefits Role:Design and code forward thinking software Location:Hybrid - 4 days a week in the Manchester city centre or Cheshire office Private equity backed + fast growth + career progression * Do you have 2+ years professional experience as a Software Developer or Software Engineer using C#, .Net, MVC? * Are you enthusiastic about learning new technology and skills? * Do you want to join a growing forward thinking software vendor? Our client is a fast growing, private equity backed SaaS company who provide a unique platform used by a number of industries to win, deliver, and manage projects profitably. By combining a number of features such as Data, Financial Information, and Project Management into one end-end cloud solution that customers love.
Software Developer;Manchester Industrial Centre, M15 4JJ;competitive salary;Insurance Revolution;We are looking for talented Software Developers to join our team. Everyone is trusted to work on their own projects whilst ensuring they hit their own deadlines and get the support to develop themselves whilst building tools that will help our staff and customers. We work in a fast paced environment and we are not afraid of changes of tech and architecture. As the business grows, we want our Software Developers to help shape and reimagine how the business operates, as no idea is a bad idea and Senior Management value the opinions and ideas from all staff. Key skills and experience * at least 2 years commercial experience * extensive knowledge of javascript / typescript * knowledge of design patterns Beneficial but not essential * message driven systems, microservices * docker / kubernetes deployment * database knowledge - both SQL and NoSQL We will offer you
Backend Software Engineer C# .Net Core API;Manchester, Greater Manchester;£45000 - £55000 per annum + benefits;CSR DevC#C++Mobile;Backend Software Engineer Remote / Leeds WFH to £55k Backend Software Engineer / Developer (C# .Net Core API AWS) *Remote / Hybrid WFH*. Would you like to progress your career working on a range of projects for big name clients? You could be joining a digital agency with ongoing training and development opportunities as well as a range of perks and benefits. As a Backend Software Engineer you will focus on serverside development for a range of client based digital transformation projects with a focus on a large, enterprise scale business. Youll collaborate as part of an Agile delivery team with exposure across the full development lifecycle. Youll be using a range of technologies including C#, ASP.Net Core, Web APIs, SQL and AWS and will have opportunities to expand your skillset with regular training.
Software Developer;M1, Manchester;£50000 - £70000 per annum;Made Talent;You will be working with one of the leading international providers of digital services which covers transformation, technology, data analytics and systems integrations services. With an average Tenure of 8 years, you will be working with a company that holds culture and employee satisfaction at the core of their values. With a goal of creating economic and social value by building a more inclusive, fair and safe society through ethical use of data and technology, you will truly feel value in your work knowing you are in Tech4Good. As a Lead Developer within a tech4good consultancy, you will be part of a diverse, multi-disciplinary team working closely with experienced Architects and Technical Delivery managers to work on solutions that help people's lives. You will play a key part in the design and delivery of all aspects of our software solutions.
Siemens Software Engineer;Newton Common, WA12;From £55,000 to £70,000 per annum + overtime;Samuel Frank Associates;Siemens TIA Portal Software Engineer Near Warrington - £55-70k + overtime for site work Samuel Frank is recruiting for a Siemens TIA Portal Software Engineer to join a multi-site specialist Engineering firm based near Warrington. The successful Siemens TIA Portal Software Engineer will need to have recent/thorough knowledge of Siemens TIA Portal with the salary dependent on your level of experience. Key aspects of the Siemens TIA Portal Software Engineer role include; * Responsible for the system configuration, including PLC code and WinCC SCADA configurations to meet project requirements. Identifying any functionality changes to be made to core software or core PLC code
Software Engineers - Geospatial;M5, Salford, M5 3LZ;Competitive Salary + Benefits;CGI;Job Description Position Description If you're looking for a challenge that stretches your talents and you want to make a real difference in people's lives, come and help us support the digital transformation of the UK. We need a passionate GIS Software Developer to join us, working with high profile public and commercial clients, building systems that make the everyday easier. Our working approach is built around our client's needs. That's not to say yours aren't important too and in a post-pandemic world, we want to extend the offer of an open discussion to you as to whether a role can be office or home-based, flexible or hybrid. There will be an initial on-site induction period in Chippenham, with the flexibility for fully remote working thereafter.
Software Engineer;M5, Salford, M5 3LZ;Competitive Salary + Benefits;CGI;Job Description Position Description If your programming skills are matched by an enthusiasm for problem-solving, and your communication skills are as creative as your coding, there's a digital revolution underway in the UK that could use your help as we are recruiting Software Engineers to work with high profile clients, building systems that make the everyday easier. You will be part of a fast-growing team supporting the technology for several large clients, mainly in the financial services sector. We have roles available to suit differing levels of experience, but everyone has the opportunity to continually grow their skills within the team. Typically, the team owns the entire solution including the application and the cloud platform on which it runs, leading to the satisfaction which comes from building and operating a complete solution to a customer's problem.
Software Engineers;M5, Salford, M5 3LZ;Competitive Salary + Benefits;CGI;Job Description Position Description Our Software Engineering teams are bursting with talent, and are trusted to help deliver transformative digital work for high profile private and public sector clients. From cutting-edge projects to essential infrastructure, our work has a wide reach. When you start your CGI story, not only will you be improving people's lives, you can be sure we'll do the same for you. CGI was voted 'Best Workplace' by Great Place To WorkTM in 2021, and offer a competitive salary, excellent pension, private healthcare, plus a share scheme (3% + 3% matching) which makes you a member not just an employee. All applicants must hold or be prepared to undergo National Security Vetting (NSV) Security Check (SC) level. Your future duties and responsibilities
Software Engineer;Westinghouse Ind Est, M17;£28000 - £45000 per annum;Chroma Recruitment Ltd;MULTIPLE ROLES: A leading engineering company in their industry have secure new projects and are rapidly expanding across all disciplines. Multiple Software Engineers are required to design scientific software for electronic based products used to improve the scientific and medical community. Graduates with a scientific degree and an interest in Software Engineering will also be considered for this role. Theyre open to graduate engineers through to mid-level/senior engineers. As Software Engineer youll be responsible for developing high level code and architecture to communicate with an engineering device. Youll be working in a full lifecycle development cycle at all stages. It is important that candidates are comfortable to do everything from design, unit testing and debugging and review of code.
Software Engineer - Machine Learning Libraries;Manchester, Greater Manchester;Competitive;ARM;Are you interested in working on Machine Learning (ML) software for the most innovative CPU technologies in server and cloud compute? We have an opening in the Machine Learning team in Manchester, UK to join a small team of Engineers focussed on making Arm-based hardware the natural choice for ML in the datacenter. In this role you will be contributing to key open source ML software projects. In particular Compute Library for the Arm Architecture; an open source software project providing machine learning functions for both CPU and GPU. You will work with colleagues in Manchester and Cambridge to optimise Compute Library for server-scale hardware, and integrate it with frameworks and libraries for deployment on our partners' hardware. You will work with exciting technology, help to implement new algorithms, and optimise for the latest Arm server hardware.
Applications Engineer;Bradley, HD2 1UR;Up to £40000.00 per annum;E3 Recruitment;This permanent Applications Engineer position is with a UK based OEM company, specialising in the installation and commissioning of manufacturing equipment within the chemical & pharmaceutical sectors. Our client is a leading supplier of special purpose machinery for an array of industries on a global scale who are recruiting for an Engineering Application Engineer. They have been established since the 1940's and have made an extremely respectable name for themselves which has resulted in them securing a number of blue chip clients along the way. Due to a very successful year they now have a requirement for an experienced Applications Engineer to bolster their established team.
Software Engineer - Node.js / React / GraphQL;M2, Manchester;£35000 - £55000 per annum;Chroma Recruitment Ltd;Software Engineer JavaScript Chroma are recruiting for a Software Engineer to join a growing team based in Manchester. The company itself are within the energy engineering sector and create wireless IOT devices. This is a hybrid role with 2 days a week on site. In this role you will be working on systems used in the real world and making a genuine difference with the development that you do. You will be joining the team as they are going through a digital transformation and work on systems used by both the public and private sector and which provide the insight needed to deliver a world where net zero is achieved. The application can monitor things such as energy usage, temperature, C02 etc and businesses can then make changes to reduce their carbon emissions. The application is data intensive and real time so any experience in those areas would be handy.
Software Engineer {MOD, Defence};M1, Manchester;£40000 - £60000 per annum + Company Benefits;Ernest Gordon Recruitment;United Kingdom £40,000 to £60,000 + Company Benefits Are you a Software Engineer looking to join a leading global engineering, aerospace, and defence company? Do you want to work on exciting and bespoke projects for organisations such as the MOD? Do you want clear progression and the opportunity to push your knowledge to the limits? On offer, is an exciting opportunity for a Software Engineer to join one of the world's largest engineering, aerospace and defence businesses working on global projects for organisations such as the MOD. Playing and integral part of a highly skilled multi-disciplined team, you will be responsible for developing technical solutions to support business processes within the global organisation and to support updates to existing solutions and software against business requirements.
Software Engineer, £70k;Manchester, Greater Manchester;£60k - 70k per year;ECOM Manchester;This is an excellent opportunity for you to really make your mark within a growing and ambitious company that that is exploiting a potentially disruptive technology within a huge growth sector. Up to £70,000, plus company benefits? Regular flexible/ Remote working? Access to company share scheme This is a unique opportunity to join an AI start-up aiming to improve the world by helping businesses better understand and improve the environmental and social impact they have on the planet. As a Senior Software Engineer you’d work alongside the CTO to design and develop highly scalable, highly available software. You’d be given the opportunity to define, document and champion coding standards, patterns, and procedures in all aspects of the technical stack, including a leading role in their further adoption of AWS, DevOps and Microservices. * NodeJs, ReactJs,
Software Engineer £50k + unlimited holidays;Manchester, Greater Manchester;£40k - 50k per year;ECOM Manchester;This is a unique opportunity for a Software Engineer to join a remote tech start-up that’s on a mission to create a sustainable future by helping people dramatically cut their carbon emissions and reduce their energy bills through the use of renewable technology. Up to £50,000 plus company benefits? Regular flexible/remote working. Unlimited Holidays You’d join a small autonomous product team that works collaboratively to build products and tools all the way from idea to production, so as well as writing, testing and deploying code, you'd also be helping to write requirements, solve problems and design architectures… which means there’s a big opportunity to make an impact!
Software Engineer, £80k + 10% Bonus;Manchester, Greater Manchester;£60k - 80k per year + benefits;ECOM Manchester;Up to £80,000, plus company benefits including… 10% bonus? Pension Scheme? Manchester office or regular flexible/remote working? 25 Days Paid Leave? Latest tech stack and tools Unique opportunity for a Software Engineer with experience of TypeScript and AWS to join an ecommerce scale-up in Manchester that have the backing of a FTSE 250 company and launched to the public late 2020 with a full UK wide TV advertising campaign. As a Software Engineer you’d be part of a product engineering department that is in the process of growing to almost 300 people and would play a key role in shaping their culture, systems and overall approach to software engineering.
IT Developer;Clayton Le Moors, BB5 5JY;Competitive + Benefits;Studio;When registering to this job board you will be redirected to the online application form. Please ensure that this is completed in full in order that your application can be reviewed. Clayton-le-Moors, Accrington Competative Salary + Benefits Play a part in building the future at Studio!! About us Studio is one of the largest online value retailers in the UK. We offer a personal shopping service to 1.9 million customers each year online via our fantastic studio.co.uk and ace.co.uk websites, App and our catalogue. We are based in Clayton-le-Moors, Accrington with great motorway links across the North West of England. About the Opportunity At Studio, we are constantly evolving & transforming, and we now have a new opportunity for an IT Developer to join our busy, growing IT Development team.
Software Engineer;Old Trafford, M5 3EA;From £35,000 to £45,000 per annum;First Central Insurance & Technology Group;Were First Central Insurance & Technology Group (First Centralfor short), an award-winning innovative insurance and technology organisation, delivering market-leading motor insurance, underwriting, distribution, finance, technology and legal services.? Were on the hunt for a talentedSoftware Engineerto join ourTechnologyteam inSalford Quays, Manchester. In this role you will use your C# .NET experience to work within a Scrum team to help build and support the companys bespoke application environment. You will need to be highly proficient in C# but also have good working knowledge of HTML, CSS & Javascript, knowledge of a SPA language (preferably Angular) and have a good understanding of SQL. * Strong C# knowledge and experience * Experience using the Angular platform * Significant exposure to SQL * Work within a Scrum team across the full development stack.
Systems Software Engineer;M1, Manchester;£40000 - £50000 per annum + + Car allowance;Your Prime Recruitment Ltd;System Software Engineer (WMS/Projects) Market Leading WMS Vendor Pivotal role in the business/Exciting projects Package: £40,000 - £50,000 + Car Allowance & Benefits We are working with a market-leading WMS vendor who provides Warehouse Management/Automation Systems to several different sectors on a global scale. As Systems Software Engineer you will be involved in designing software solutions across a variety of WMS, Automation and Supply Chain Management platforms. Reporting to the Head of IT, the Engineer will contribute to all aspects of project engineering within the team and will take the lead in creating designer documentation for systems. System Software Engineer (WMS/Projects) - Responsibilities * Manage drafted system solutions from Software consulting department. * Discuss each drafted logistical / customer requirement at external and internal workshops
Software Engineer - PLC Programming;OL11, Rochdale;£45000 - £50000 per annum + + overtime + excellent benefits;Revorec Recruitment Solutions;£45,000 - £50,000 + overtime + excellent company benefits Rochdale, North West Are you an electrical engineer with PLC programming experience looking for a challenging role within a rapidly expanding company offering further technical development and overtime? On offer is a unique opportunity to work for a specialist manufacturer where you will be the go-to engineer for developing an array of PLC and SCADA systems. This is an autonomous role working within a highly skilled technical department, where you will design and program PLC's from scratch and be involved in commissioning developed systems on site. This is a fantastic chance to work in a leading role where you will play a crucial part in the continued success of the business.
Software Engineer;Westinghouse Ind Est, M17 1HH;Competitive;IGT;Software Eng (Dev) II Location: Manchester IGT is the global leader in gaming. We enable players to experience their favourite games across all channels and regulated segments, from Gaming Machines to Lotteries to Interactive. We have a well-established local presence and relationships with governments and regulators in more than 100 countries around the world, and create value by adhering to the highest standards of service, integrity, and responsibility. IGT has over 12,000 employees. Responsibilities IGT is seeking a talented, hard-working .NET Developer to join our development team in implementing solutions using Visual Studio, C# and SQL Server. The Systems Group project team develops mission-critical applications to support manufacturing and business processes. IGT is looking for team players with experience delivering integrated solutions. Qualifications
Software Engineer {C#, .NET};CW1, Crewe;£50000 - £70000 per annum + Company Benefits + Progression;Ernest Gordon Recruitment;Crewe £50,000 to £70,000 + Company Benefits + Progression + Training Are you Software Engineer looking to progress quickly and run projects while working with some of the most prestigious clients in the UK? Do you want to work with cutting edge technologies providing bespoke software solutions? Do you want the opportunity to work on a variety of bespoke .NET web and software projects for clients across a diverse range of sectors: sport, automotive, travel, environmental, transport, film, etc., and will work with the latest tech and approaches? On offer is a unique opportunity for a Software Engineer to take a lead role in a cutting-edge, leading digital agency based in the North of England.
Software Engineer (C++);Parkgate Industrial Estate, WA16;£35000 - £55000 per annum;Chroma Recruitment Ltd;MULTIPLE ROLES: Due to growth, this client is looking for Software Engineers from mid-level to Senior, working as part of an agile development team, youll become a valuable asset to this cutting-edge tech company delivering effective solutions to the automation market. The role of Software Engineer will be rewarding as youll experience the full life cycle of the product and will be able to take this opportunity to grow their own engineering knowledge and use it to help other people. This role sits within a multi-functional team of engineers ranging from electronics, software, mechanical and test. The Software Engineer will work as part of an ambitious team developing software tools for the automation market aimed at improving how we live. * Degree qualified or equivalent in Computer Science or Software Engineering * C++ programming experience (*essential*)
